{
  "active_goal_file": "PROJECT_GOAL.md",
  "active_task_count": 1,
  "last_updated": "2026-05-08T00:00:00Z",
  "template_name": "ROWS — Repo-Orchestrated Worker System",
  "assignment_model": "capability -> role -> preferred worker -> active worker",
  "mode": "idle",
  "current_phase": "intake",
  "notes": "Template default state. Fill PROJECT_GOAL.md before starting any worker.",
  "repo_name": "[PROJECT_NAME]",
  "capability_registry_file": "agent-os/state/capability-registry.json",
  "assignment_state_file": "agent-os/state/assignment-state.json",
  "execution_mode": "solo"
}
